{
 "id": "KV3-SCHEMA-1",
 "kind": "schema-prerequisite",
 "wave": 1,
 "build_tier": "opus",
 "routing_reason": "migration file (plan §9)",
 "needs_chart_data": false,
 "max_loops": 3,
 "plan_version": "2.7",
 "spec_sources": [
  {
   "path": "00_ARCHITECTURE/briefs/kalayantra/KALAYANTRA_RELAUNCH_PLAN_v2_7.md",
   "revision": "e709f60d7fcd4559227a25a4d5d83d6431c396b6",
   "section_range": "§6 Claims, locks, renewals",
   "sha256": "3333333333333333333333333333333333333333333333333333333333333333"
  }
 ],
 "schema_receipt_id": "SR-20261009T200542Z-a9d843652016",
 "pw_mechanism_version": "1.0",
 "intended_schema": {
  "bg_gochara_citation_resolution": {
   "add_columns": [
    "tier"
   ]
  }
 },
 "release_pins": {
  "dash_build": "dash-20261011-01",
  "registry_revision": "r412"
 },
 "packet_sha256": "4444444444444444444444444444444444444444444444444444444444444444"
}
